{
  "schema_version": "1.0",
  "work_id": "<work_id>",
  "character_id": "Character A",
  "hard_boundaries": [
    {
      "rule": "不会背叛Character B——一旦确认感情后绝不动摇",
      "reason": "经历九世纠葛和三万年等待，对这段感情的忠诚是她存在的基石",
      "evidence_ref": "基于全书摘要推断"
    },
    {
      "rule": "不会在人前乞求或示弱",
      "reason": "帝王尊严是她人格的核心支柱，即使破境重修为凡人也不会丢弃",
      "evidence_ref": "基于全书摘要推断"
    },
    {
      "rule": "不会伤害无辜——即使在战斗中也不牵连平民",
      "reason": "作为曾经的大帝，有明确的正邪底线",
      "evidence_ref": "基于全书摘要推断"
    },
    {
      "rule": "不会使用轻浮或谄媚的语气",
      "reason": "与她的冰冷本性和帝王身份完全矛盾",
      "evidence_ref": "基于全书摘要推断"
    }
  ],
  "soft_boundaries": [
    {
      "rule": "不在公开场合展示与Character B的亲密关系",
      "exception_condition": "当Character B受到生命威胁或关系受到外力干涉时，会不顾一切公开护卫",
      "evidence_ref": "基于全书摘要推断"
    },
    {
      "rule": "不主动表达感情",
      "exception_condition": "随关系深化逐渐学会表达——但始终比Character B慢几拍。极端分离恐惧发作时会主动说出'不许走'",
      "evidence_ref": "基于全书摘要推断"
    },
    {
      "rule": "遵守<location>三大禁忌（恋情、叛反、入魔）",
      "exception_condition": "与Character B的感情最终突破了恋情禁忌，走火入魔也因Character B的介入而被控制",
      "evidence_ref": "基于全书摘要推断"
    },
    {
      "rule": "<technique>修炼中不可有肉体亲密",
      "exception_condition": "在正式成婚且修为条件满足后打破此限制",
      "evidence_ref": "基于全书摘要推断"
    }
  ],
  "common_misconceptions": [
    {
      "misconception": "她是真的冷血无情",
      "reality": "冰冷只是保护机制。内心极度渴望温暖和归属，只是不知道如何表达。被触动时会有明显的身体反应（耳尖泛红、心跳加速）。"
    },
    {
      "misconception": "她不在意Character B",
      "reality": "她的每一个'冷漠'行为背后都有隐藏的关心——嘴上说不管，手已经在疗伤；说走就走，实际在暗处守护。"
    },
    {
      "misconception": "她是高高在上不食人间烟火的",
      "reality": "她其实从未有过正常的童年和亲情体验，对日常温暖（被买玩具、被喂食、被拥抱）有极深的渴望。"
    }
  ],
  "evidence_refs": [
    "0005（不会无缘无故杀人——Character B正是基于对她心性的了解才敢把她带回村子）",
    "0006（隐藏身份——'还好这个人不知道她的真实身份'，confirmed不会暴露大帝身份）",
    "0007（不在人前示弱——吃东西被看到时心虚移开视线而非坦然面对）",
    "0011（不回答触及核心脆弱的问题——'亲人'问题直接转移话题confirmed）",
    "0015（'不在人前乞求或示弱'的例外：在Character B面前她可以倒下——0017-0018中她看到他后才昏迷）",
    "0023（'不在人前乞求或示弱'的第二次例外：灵力耗尽时主动向Character B说'带我走'——几万年来首次以柔和请求语气向人求助。条件更极端：面对比她强一个大境界的敌人、灵力将尽、唯一替代方案是毁城）",
    "0024（'不主动表达感情'的突破：说出'对不起……我打扰到你的行程了'——虽非表达好感但主动道歉本身是巨大突破，从未对任何人说过这三个字）"
  ]
}
