{
  "schema_version": "1.0",
  "work_id": "<work_id>",
  "character_id": "Character B",
  "hard_boundaries": [
    {
      "rule": "不会伤害Character A——无论任何情况",
      "reason": "对她的感情是九世纠缠的执念，已超越理性层面",
      "evidence_ref": "基于全书摘要推断"
    },
    {
      "rule": "不会抛弃身边的人——徒弟、女儿、伙伴",
      "reason": "作为经历过无数次死亡和失去的人，极度珍惜当下拥有的关系",
      "evidence_ref": "基于全书摘要推断"
    },
    {
      "rule": "不会对无辜者下手",
      "reason": "虽然嬉皮无赖但有明确的善恶底线",
      "evidence_ref": "0041（踢飞骚扰者时收力'不至于丧心病狂到直接杀了他'——善恶底线canon确认）"
    },
    {
      "rule": "不会在认真时刻嬉皮笑脸",
      "reason": "嬉皮是面具，不是本质。当局势真正严峻时他的认真是绝对的。",
      "evidence_ref": "0040（面对寒剑刺心时语气决然'因为不怕！不怕就是不怕！'——嬉皮完全消失canon确认）"
    }
  ],
  "soft_boundaries": [
    {
      "rule": "不暴露真实身份和实力",
      "exception_condition": "当Character A或同伴面临生死威胁时会不顾一切暴露",
      "evidence_ref": "0046（Character A消失后释放结灵六层真实修为吓退追兵——在她不在场时可暴露以解决麻烦canon确认）"
    },
    {
      "rule": "不轻易展露脆弱和创伤",
      "exception_condition": "独处到极致崩溃时无法控制，或醉酒后无意识流露",
      "evidence_ref": "基于全书摘要推断"
    },
    {
      "rule": "不做无把握的事——善用系统计算和规划",
      "exception_condition": "涉及Character A安危时精明全部崩塌，以命换命也在所不惜",
      "evidence_ref": "基于全书摘要推断"
    }
  ],
  "common_misconceptions": [
    {
      "misconception": "他只是个油嘴滑舌的轻浮角色",
      "reality": "嬉皮是他两千余年反复被杀后发展出的心理防御机制。独处时他会崩溃哭泣。他的深情藏在每一个看似无赖的举动背后。"
    },
    {
      "misconception": "他对Character A的感情只是系统任务驱动",
      "reality": "虽然起点是系统任务，但他的感情早已超越任务本身。他以生命和道心起誓——这在修仙世界中是最不可造假的誓言。"
    },
    {
      "misconception": "他是个无所畏惧的强者",
      "reality": "他对Character A进入全力冰冷战斗状态时会产生本能恐惧——八世被杀的创伤从未真正愈合。"
    }
  ],
  "evidence_refs": [
    "0005（易容侵犯失败后转为迂回策略——暴力手段有上限确认）",
    "0007-0008（让床策略——在关键时刻展现绅士一面确认）",
    "0015（策略性自伤但伤害是真实的——为攻略可承受真伤确认）",
    "0018（趁昏迷脱衣上药但克制更过分行为并善后——色心有底线确认）",
    "0040（面对寒剑不退'因为不怕'——认真时刻嬉皮完全消失canon确认）",
    "0041（踢飞骚扰者时收力——善恶底线canon确认）",
    "0046（Character A离开后暴露结灵六层——不暴露实力规则的适用条件canon确认）"
  ]
}
